{
  "format": "architex-validation-rules",
  "version": 1,
  "defaultRuleEnabled": true,
  "rules": [
    {
      "id": "highlight-unconnected-data-points",
      "name": "Highlight unconnected data points in red",
      "enabled": false,
      "source": "for (const instance of api.instances.all()) {\n  for (const point of api.instances.ports(instance.id)) {\n    if (!api.instances.connected(instance.id, point.id)) {\n      api.highlightPort(instance.id, point.id, 'red', instance.name + ' → ' + point.name + ': unconnected data point');\n    }\n  }\n}"
    }
  ]
}
